label	message
spam	freemsgfeelin kinda lnly hope u like keep me company jst got a cam moby wanna c my pictxt or reply date to msgp rcv hlp stop to
spam	your free ringtone is waiting to be collected simply text the password mix to to verify get usher and britney fml po box mk h ppw
ham	yeah confirmed for you staying at that weekend
ham	im job profile seems like bpo
ham	university of southern california
spam	cmon babe make me horny turn me on txt me your fantasy now babe im hot sticky and need you now all replies cost cancel send stop
ham	ok then r we meeting later
ham	yeah whatever lol
ham	thanks for loving me so you rock
ham	yeah we can probably swing by once my roommate finishes up with his girl
ham	must come later i normally bathe him in da afternoon mah
ham	funny fact nobody teaches volcanoes erupt tsunamis arise hurricanes sway aroundn no teaches hw choose a wife natural disasters just happens
ham	how is your schedule next week i am out of town this weekend
ham	the ltgt g that i saw a few days ago the guy wants sell wifi only for ltgt and with g for ltgt thats why i blanked him
ham	nothing can
ham	v skint too but fancied few bevieswaz gona go meet othrs in spoon but jst bin watchng planet earthsofa is v comfey if i dont make it hav gd night
ham	sounds like a plan cardiff is still here and still cold im sitting on the radiator
ham	anyway i dont think i can secure anything up here lemme know if you want me to drive down south and chill
ham	i love you both too
ham	dear why you mood off i cant drive so i brother to drive
ham	another month i need chocolate weed and alcohol
ham	mean its confirmed i tot they juz say oni ok then
ham	so li hai me bored now da lecturer repeating last weeks stuff waste time
spam	you ve won your costa del sol holiday or await collection call now toclaim sae tc s pobox stockport skxh costpm maxmins
ham	wake me up at ltgt am morning
ham	i know but you need to get hotel now i just got my invitation but i had to apologise cali is to sweet for me to come to some english blokes weddin
ham	hey congrats u id luv but ive had go home
ham	unless its a situation where you go gurl would be more appropriate
ham	hows my loverboy doing what does he do that keeps him from coming to his queen hmmm doesnt he ache to speak to me miss me desparately
ham	honey boo im missing u
spam	win the newest harry potter and the order of the phoenix book reply harry answer questions chance to be the first among readers
ham	mine here like all fr china then so noisy
ham	happy new year princess
ham	are you this much buzy
ham	i want to sent ltgt mesages today thats y sorry if i hurts
ham	r u meeting da ge at nite tmr
spam	urgent we are trying to contact you last weekends draw shows u have won a prize guaranteed call claim code k valid hrs p pm
ham	im used to it i just hope my agents dont drop me since ive only booked a few things this year this whole me in boston them in nyc was an experiment
ham	no but the bluray player can
ham	sorry ill call later
ham	think you sent the text to the home phone that cant display texts if you still want to send it his number is
ham	meet you in corporation st outside gap you can see how my mind is working
spam	themob check out our newest selection of content games tones gossip babes and sport keep your mobile fit and funky text wap to
ham	but im really really broke oh no amount is too small even ltgt
ham	beautiful truth expression of the face could be seen by everyone but the depression of heart could be understood only by the loved ones gud ni
ham	good morning my dear have a great amp successful day
ham	im back amp were packing the car now ill let you know if theres room
ham	were somewhere on fredericksburg
ham	youve always been the brainy one
ham	i call you later dont have network if urgnt sms me
ham	oh ok wait me there my lect havent finish
ham	true deari sat to pray evening and felt soso i smsd you in some time
ham	i can take you at like noon
ham	ya ok vikky vl c witin ltgt mins and il reply u
ham	ello babe u ok
ham	hi my engagement has been fixd on ltgt th of next month i know its really shocking bthmm njan vilikkamt ws al of a sudn
ham	have you bookedthe hut and also your time off how are you by the way
ham	sorry i cant text amp drive coherently see you in twenty
ham	i anything lor
ham	i want to be there so i can kiss you and feel you next to me
spam	hi its lucy hubby at meetins all day fri i will b alone at hotel u fancy cumin over pls leave msg day lucy x callsminmobsmorelkpoboxhpfl
ham	s but mostly not like that
ham	hello handsome are you finding that job not being lazy working towards getting back that net for mummy wheres my boytoy now does he miss me
ham	hello yeah ive just got out of the bath and need to do my hair so ill come up when im done yeah
spam	congrats mobile g videophones r yours call now videochat wid ur mates play java games dload polyph music noline rentl bx ip we p
ham	wait i will msg after ltgt min
ham	save yourself the stress if the person has a dorm account just send your account details and the money will be sent to you
ham	want to send me a virtual hug i need one
ham	i sent my scores to sophas and i had to do secondary application for a few schools i think if you are thinking of applying do a research on cost also contact joke ogunrinde her school is one me the less expensive ones
ham	i can send you a pic if you like
ham	solve d case a man was found murdered on ltdecimalgt ltgt afternoon his wife called police police questioned everyone wife siri was sleeping when the murder took place cook i was cooking gardener i was picking vegetables housemaid i went d post office children we went play neighbour we went a marriage police arrested d murderer immediately whos it reply with reason if u r brilliant
ham	hey i booked the kb on sat already what other lessons are we going for ah keep your sat night free we need to meet and confirm our lodging
spam	congratulations ur awarded either a yrs supply of cds from virgin records or a mystery gift guaranteed call tscs wwwsmsconet pm approx mins
ham	im still pretty weak today bad day
spam	someone u know has asked our dating service contact you cant guess who call now all will be revealed po box m wu
ham	its going goodno problembut still need little experience to understand american customer voice
ham	if you still havent collected the dough pls let me know so i can go to the place i sent it to get the control number
ham	should i buy him a blackberry bold or torch should i buy him new or used let me know plus are you saying i should buy the ltgt g wifi ipad and what are you saying about the about the ltgt g
ham	hmm shall i bring a bottle of wine to keep us amused just joking ill still bring a bottle red or white see you tomorrow
ham	sorry ill call later
ham	sad puppy noise
ham	hhahhaahahah rofl wtf nig was leonardo in your room or something
ham	i love to wine and dine my lady
spam	we tried to contact you re your reply to our offer of a video handset anytime networks mins unlimited text camcorder reply or call now
ham	happy birthday may u find ur prince charming soon n dun work too hard
ham	its to get in is that ok
ham	y de asking like this
ham	when should i come over
ham	well i wasnt available as i washob nobbing with last night so they had to ask nickey platt instead of me
ham	horrible bf i now v hungry
ham	derp which is worse a dude who always wants to party or a dude who files a complaint about the three drug abusers he lives with
ham	i like to talk pa but am not able to i dont know y
spam	all the lastest from stereophonics marley dizzee racal libertines and the strokes win nookii games with flirt click themob wap bookmark or text wap to
ham	i have a sore throat its scratches when i talk
ham	actually i decided i was too hungry so i havent left yet v
ham	you stayin out of trouble strangersaw dave the other day hes sorted nowstill with me bloke when u gona get a girl mrur mum still thinks we will get getha
ham	very strange and are watching the nd one now but im in bed sweet dreams miss u
ham	i will come with karnan car please wait till pm will directly goto doctor
ham	hi do u want to join me with sts later meeting them at five call u after class
ham	did u find out what time the bus is at coz i need to sort some stuff out
ham	er yeah i will b there at sorry just tell me which pubcafe to sit in and come wen u can
ham	thats the trouble with classes that go well youre due a dodgey one expecting mine tomo see you for recovery same time same place
ham	aight tomorrow around ltgt it is
spam	sms services for your inclusive text credits pls gotto wwwcomuknet login qxj unsubscribe with stop no extra charge help comukcm ae
ham	say this slowly godi love you amp i need youclean my heart with your bloodsend this to ten special people amp u c miracle tomorrow do itplspls do it
ham	but i haf enuff space got like mb
ham	i dont thnk its a wrong calling between us
spam	goldviking m is inviting you to be his friend reply yes or no see him wwwsmsacugoldviking stop send stop frnd to
ham	yeah he got in at and was v apologetic n had fallen out and she was actin like spoilt child and he got caught up in that till but we wont go there not doing too badly cheers you
ham	its still not working and this time i also tried adding zeros that was the savings the checking is ltgt
ham	great i have to run now so ttyl
ham	ahhhhjust woken uphad a bad dream about u thoso i dont like u right now i didnt know anything about comedy night but i guess im up for it
ham	frnd s not juz a wordnot merely a relationshipits a silent promise which says i will be with you wherevr whenevr forevr gudnyt dear
ham	am up to my eyes in philosophy
ham	im not sure if its still available though
ham	please leave this topicsorry for telling that
ham	who u talking about
spam	free msg ringtonefrom httptms widelivecomindex wmlidbaeceffffirsttruejul
ham	have a safe trip to nigeria wish you happiness and very soon company to share moments with
ham	babe have you got enough money to pick up bread and milk and ill give you it back when you get home
ham	glad it went well come over at then well have plenty of time before claire goes to work
ham	sif we have one good partnership going we will take lead
spam	camera you are awarded a sipix digital camera call fromm landline delivery within days
ham	ive got it down to a tea not sure which flavour
ham	he needs to stop going to bed and make with the fucking dealing
ham	ill meet you in the lobby
ham	to day class is there are no class
spam	adult content your video will be with you shortly
ham	i thank you so much for all you do with selflessness i love you plenty
ham	dont you have message offer
ham	you are right meanwhile hows project twins comin up
ham	tiwary to rcbbattle between bang and kochi
ham	no im not gonna be able to too late notice ill be home in a few weeks anyway what are the plans
spam	from next month get upto more calls ur standard network charge activate call c wirenet stterms pobox m uz cost min mobcudb more
ham	er hello things didnt quite go to plan is limping slowly home followed by aa and with exhaust hanging off
ham	goodnight da thangam i really miss u dear
ham	what are youdoing later sar xxx
ham	oops i did have it ltgt
spam	freemsg our records indicate you may be entitled to pounds for the accident you had to claim for free reply with yes to this msg to opt out text stop
ham	hmmmbut you should give it on one day
ham	how i noe did specify da domain as nusstu still in sch
ham	no da vijay going to talk in jaya tv
ham	huh so early then having dinner outside izzit
ham	i want to show you the world princess how about europe
ham	i feel like a dick because i keep sleeping through your texts and facebook messages sup you in town
ham	gud niswt drmstake care
ham	no go no openings for that room til after thanksgiving without an upcharge
ham	tell me something thats okay
spam	you are being ripped off get your mobile content from wwwclubmobycom call polytruepixringtonesgames six downloads for only
ham	let there be snow let there be snow this kind of weather brings ppl together so friendships can grow
ham	am only searching for good dual sim mobile pa
ham	hey darlin i can pick u up at college if u tell me wen where mt love pete xx
ham	say until like dat i dun buy ericsson oso cannot oredi lar
ham	our prasanth ettans mother passed away last night just pray for her and family
ham	yeah probably i still gotta check out with leo
ham	ok
ham	printer is cool i mean groovy wine is groovying
ham	my friend shes studying at warwick weve planned to go shopping and to concert tmw but it may be canceled havnt seen for ages yeah we should get together sometime
ham	aight fuck it ill get it later
ham	y wan to go there c doctor
ham	y dun cut too short leh u dun like ah she failed shes quite sad
ham	we took hooch for a walk toaday and i fell over splat grazed my knees and everything should have stayed at home see you tomorrow
ham	can you do online transaction
ham	oh fuck juswoke up in a bed on a boatin the docks slept wid year old spinout giv u da gossip lr xxx
ham	u buy newspapers already
ham	minimum walk is miles a day
ham	dearregret i cudnt pick calldrove down frm ctla now at cochin homeleft mobile in carente style ishtamayoohappy bakrid
ham	i not free today i haf pick my parents up tonite
ham	hurry up ive been weeddeficient for like three days
ham	lol now im after that hot air balloon
ham	then its most likely called mittelschmertz google it if you dont have paracetamol dont worry it will go
ham	im good i have been thinking about you
ham	yeah just open chat and click friend lists then make the list easy as pie
ham	there are no other charges after transfer charges and you can withdraw anyhow you like
ham	sorry ill call later
ham	im at home please call
ham	what todaysundaysunday is holidayso no work
ham	have you got xmas radio times if not i will get it now
spam	are you unique enough find out from th august wwwareyouuniquecouk
ham	yup im elaborating on the safety aspects and some other issues
ham	dont know you bring some food
ham	its wylie you in tampa or sarasota
ham	thats y we haf to combine n c how lor
ham	my life means a lot to me not because i love my life but because i love the people in my life the world calls them friends i call them my world ge
ham	how come guoyang go n tell her then u told her
ham	ah poop looks like ill prob have to send in my laptop to get fixed cuz it has a gpu problem
ham	he said i look pretty wif long hair wat but i thk hes cutting quite short me leh
ham	just send a text well skype later
spam	freemsg txt call to no claim your reward of hours talk time to use from your phone now subscribegbpmnth inc hrs stoptxtstop
ham	can you just come in for a sec theres somebody here i want you to see
ham	mum hope you are having a great day hoping this text meets you well and full of life have a great day abiola
ham	no am working on the ringing u thing but have whole houseful of screaming brats so am pulling my hair out loving u
ham	no shes currently in scotland for that
ham	good morning pookie pie lol hope i didnt wake u up
ham	men like shorter ladies gaze up into his eyes
ham	our prashanthettans mother passed away last night pray for her and family
ham	yagoing for restaurant
ham	i got lousy sleep i kept waking up every hours to see if my cat wanted to come in i worry about him when its cold
ham	aww you must be nearly deadwell jez iscoming over todo some workand that whilltake forever
ham	if u sending her home first its ok lor im not ready yet
ham	i wont get concentration dear you know you are my mind and everything
ham	i cant pick the phone right now pls send a message
ham	anything is valuable in only situations first before getting it second after loosing it
spam	as a valued customer i am pleased to advise you that following recent review of your mob no you are awarded with a bonus prize call
ham	hi where are you were at and theyre not keen to go out i kind of am but feel i shouldnt so can we go out tomo dont mind do you
ham	cbe is really good nowadayslot of shop and showroomscity is shaping good
ham	tell you what if you make a little spreadsheet and track whose idea it was to smoke to determine who smokes too much for the entire month of february ill come up
ham	how are you i miss you
ham	ok so april cant wait
ham	ok now i am in bus if i come soon i will come otherwise tomorrow
ham	anything
ham	was gr to see that message so when r u leaving congrats dear what school and wat r ur plans
ham	got but got colours lor one colour is quite light n e other is darker lor actually im done shes styling my hair now
ham	tomarrow i want to got to court at ltdecimalgt so you come to bus stand at
ham	wifehow she knew the time of murder exactly
ham	we have to pick rayan macleran there
ham	moji i love you more than words have a rich day
ham	aight i should be there by at the latest probably closer to are jay and tyler down or should we just do two trips
ham	we r stayin here an extra week back next wed how did we do in the rugby this weekend hi to and and c u soon
spam	you are chosen to receive a award pls call claim number to collect your award which you are selected to receive as a valued mobile customer
ham	ok then u tell me wat time u coming later lor
ham	thats alrite girl u know gail is neva wrongtake care sweet and dont worryc u ltr hunlove yaxxx
ham	i am great princess what are you thinking about me
ham	okey dokey ill be over in a bit just sorting some stuff out
ham	im late tellmiss im on my way
spam	married local women looking for discreet action now real matches instantly to your phone text match to msg cost p stop txt stop bcmsfwcnxx
ham	alright took the morphine back in yo
ham	im at home please call
ham	cuz ibored and don wanna study
ham	he fucking chickened out he messaged me he would be late and woould buzz me and then i didnt hear a word from him
ham	jay says that youre a doublefaggot
spam	your weekly coolmob tones are ready to download this weeks new tones include crazy frogaxel f akonlonely black eyeddont p more info in n
ham	pa but not selected
ham	mum not going robinson already
ham	you dont know you jabo me abi
ham	ryder unsoldnow gibbs
ham	mm not entirely sure i understood that text but hey ho which weekend
ham	usually the person is unconscious thats in children but in adults they may just behave abnormally ill call you now
ham	im home my love if your still awake loving kiss
ham	hi darlin i hope you had a nice night i wish i had come cant wait to see you love fran ps i want dirty anal sex and i want a man gang bang
ham	no callsmessagesmissed calls
spam	please call immediately as there is an urgent message waiting for you
ham	wifehow she knew the time of murder exactly
spam	six chances to win cash from to pounds txt csh and send to cost pday days tsandcs apply reply hl info
ham	my friends use to call the same
ham	its not that you make me cry its just that when all our stuff happens on top of everything else it pushes me over the edge you dont underdtand how often i cry over my sorry sorry life
ham	east coast
ham	hey so whats the plan this sat
ham	ooooooh i forgot to tell u i can get on yoville on my phone
ham	still chance there if you search hard you will get itlet have a try
ham	geeee i miss you already you know your all i can think about fuck i cant wait till next year when we will be together loving kiss
ham	havent left yet so probably gonna be here til dinner
spam	u have a secret admirer who is looking make contact with ufind out who they rreveal who thinks ur so specialcall on
ham	check with nuerologist
ham	then she buying today no need to c meh
spam	double your mins txts on orange or price linerental motorola and sonyericsson with btooth freenokia free call mobileupd on oroptouthvd
ham	hahahause your brain dear
ham	i was up all night too worrying about this appt its a shame we missed a girls night out with quizzes popcorn and you doing my hair
ham	how have your little darlings been so far this week need a coffee run tomocant believe its that time of week already
ham	i accidentally deleted the message resend please
ham	done it but internet connection v slow and cant send it will try again later or first thing tomo
ham	probably not still going over some stuff here
ham	so do you have samus shoulders yet
ham	ure welcome caught u using broken english again
ham	vikky come around lttimegt
ham	waaaat lololo ok next time then
ham	sorry ill call later
spam	private your account statement for shows unredeemed sim points call identifier code expires
ham	just checked out heading out to drop off my stuff now
ham	yup hey then one day on fri we can ask miwa and jiayin take leave go karaoke
ham	not a lot has happened here feels very quiet beth is at her aunts and charlie is working lots just me and helen in at the mo how have you been
ham	hi dear call me its urgnt i dont know whats your problem you dont want to work or if you have any other problem at least tell me wating for your reply
ham	hi mate its rv did u hav a nice hol just a message say hello coz havent sent u in ages started driving so stay off roadsrvx
spam	our brand new mobile music service is now live the free music player will arrive shortly just install on your phone to browse content from the top artists
ham	going for dinnermsg you after
ham	so what about you what do you remember
ham	olol i printed out a forum post by a guy with the exact same prob which was fixed with a gpu replacement hopefully they dont ignore that
ham	i cant describe how lucky you are that im actually awake by noon
ham	darren was saying dat if u meeting da ge den we dun meet dinner cos later u leave xy will feel awkward den u meet him lunch lor
ham	thk shld b can ya i wana go lessons haha can go for one whole stretch
ham	don knowwait i will check it
ham	omg if its not one thing its another my cat has worms when does this bad day end
spam	p alfie moons children in need song on ur mob tell ur ms txt tone charity to for nokias or poly charity for polys zed profit charity
ham	lol i really need to remember to eat when im drinking but i do appreciate you keeping me company that night babe smiles
ham	give me a sec to think think about it
ham	have good weekend
ham	i only haf msn its yijuehotmailcom
ham	speaking of does he have any cash yet
ham	kent vale lor wait me there ar
ham	its cool but tyler had to take off so were gonna buy for him and drop it off at his place later tonight our total order is a quarter you got enough
ham	dunno lei i might b eatin wif my frens if wan to eat then i wait lar
ham	its ok i wun b angry msg u aft i come home tonight
ham	bring tat cd don forget
ham	whatsup there dont u want to sleep
ham	finish liao u
spam	youve won tkts to the euro cup final or cash to collect call b pobox ppm
ham	your daily text from me a favour this time
ham	tell rob to mack his gf in the theater
ham	i met you as a stranger and choose you as my friend as long as the world stands our friendship never ends lets be friends forever gud nitz
ham	brainless baby dolld vehicle sariyag drive madoke barolla
ham	i want to grasp your pretty booty
ham	height of confidence all the aeronautics professors wer calld amp they wer askd sit in an aeroplane aftr they sat they wer told dat the plane ws made by their students dey all hurried out of d plane bt only didnt move he saidif it is made by my studentsthis wont even start datz confidence
spam	money i have won wining number wot do i do next
ham	hi did u decide wot get his bday if not ill prob jus get him a voucher frm virgin or sumfing
ham	happy birthday may all ur dreams come true
ham	piss is talking is someone that realise u that point this at is itnow read it backwards
ham	two teams waiting for some players
ham	or go buy wif him then i meet later can
ham	boo babe u enjoyin yourjob u seemed b gettin on well hunnyhope ure oktake care illspeak u soonlots of loveme xxxx
ham	cab is availablethey pick up and drop at door steps
ham	hey chief can you give me a bell when you get this need to talk to you about this royal visit on the st june
ham	nothing smsing u n xy lor sorry lor da guys neva c u in person but they sort of know u lor so u wan meet them xy ask me bring u along our next meeting
spam	thanks for your ringtone order reference number x your mobile will be charged should your tone not arrive please call customer services from colourredtextcolourtxtstar
ham	please protect yourself from ethreats sib never asks for sensitive information like passwordsatmsms pin thru email never share your password with anybody
spam	sms ac sun posts helloyou seem cool wanted to say hi hi stop send stop to
ham	im in a meeting call me later at
ham	thnx dude u guys out nite
ham	i want to see your pretty pussy
spam	congratulations thanks to a good friend u have won the xmas prize claim is easy just call now only p per minute btnationalrate
ham	just normal only here
ham	si think he is waste for rr
spam	urgent your mobile no was awarded a bonus caller prize on this is our nd attempt to contact you call boxqu bt national rate
ham	you call him now ok i said call him
ham	are you up for the challenge i know i am
ham	just do what ever is easier for you
ham	are you driving or training
ham	for real when u getting on yo i only need more tickets and one more jacket and im done i already used all my multis
spam	rock yr chik get s of filthy films xxx pics on yr phone now rply filth to saristar ltd e yt p per days stop cancel
ham	oh sorry please its over
ham	ssindia going to draw the series after many years in south african soil
spam	hmv bonus special pounds of genuine hmv vouchers to be won just answer easy questions play now send hmv to more infowwwpercentrealcom
ham	every king was once a crying baby and every great building was once a map not imprtant where u r today but where u wil reach tomorw gud ni
ham	goodmorning today i am late for hr
ham	was actually about to send you a reminder today have a wonderful weekend
ham	its a part of checking iq
ham	yes just finished watching days of our lives i love it
