label	message
spam	we have new local dates in your area lots of new people registered in your area reply date to start now only wwwflirtpartyus replys
ham	how come she can get it should b quite diff to guess rite
ham	serious what like proper tongued her
ham	i am back bit long cos of accident on a had to divert via wadebridgei had a brilliant weekend thanks speak soon lots of love
ham	garbage bags eggs jam bread hannaford wheat chex
ham	happy birthday to youdearwith lots of loverakhesh nri
ham	yesfrom last week itself im taking live call
ham	are you angry with me what happen dear
spam	important information orange user today is your lucky dayfind out why log onto httpwwwurawinnercom theres a fantastic surprise awaiting you
ham	and half years i missed your friendship
spam	httptms widelivecomindex wmlidadafirsttruec c ringtone
spam	how come it takes so little time for a child who is afraid of the dark to become a teenager who wants to stay out all night
ham	i dont want to hear philosophy just say what happen
ham	i am literally in bed and have been up for like ltgt hours
spam	want to funk up ur fone with a weekly new tone reply tonesu this text wwwringtonescouk the original n best tones gbp network operator rates apply
ham	im stuck in da middle of da row on da right hand side of da lt
ham	my house here e sky quite dark liao if raining then got excuse not run already rite hee
ham	ok i wont call or disturb any one i know all are avoiding me i am a burden for all
ham	okay good no problem and thanx
spam	bloomberg message center why wait apply for your future httpcareers bloombergcom
ham	prabhaim sorydarealyfrm heart im sory
ham	you will be in the place of that man
ham	if you dont respond imma assume youre still asleep and imma start calling n shit
ham	its reassuring in this crazy world
ham	i taught that ranjith sir called me so only i sms like that becaus hes verifying about project prabu told today so only pa dont mistake me
ham	only once then after ill obey all yours
ham	well theres a pattern emerging of my friends telling me to drive up and come smoke with them and then telling me that im a weed fiendmake them smoke too muchimpede their doing other things so you see how im hesitant
ham	have you seen whos back at holby
ham	prabhaim sorydarealyfrm heart im sory
ham	you will be in the place of that man
ham	are you in castor you need to see something
ham	how much she payed suganya
spam	welcome please reply with your age and gender to begin eg m
ham	this is a long fuckin showr
ham	excellent are you ready to moan and scream in ecstasy
ham	dear heroi am leaving to qatar tonite for an apt opportunitypls do keep in touch at ltemailgt kerala
ham	noits ful of song lyrics
ham	dont know supports ass and srt i thnk i think ps can play through usb too
ham	shes borderline but yeah whatever
ham	actually nvm got hella cash we still on for ltgt ish
ham	where are youwhen wil you reach here
spam	this message is free welcome to the new improved sex dogging club to unsubscribe from this service reply stop msgsp only
ham	theres no point hangin on to mr not right if hes not makin u happy
ham	yup thk of u oso boring wat
ham	just got up have to be out of the room very soon i hadnt put the clocks back til at i shouted at everyone to get up and then realised it was wahay another hour in bed
ham	where are the garage keys they arent on the bookshelf
ham	cheers lou yeah was a goodnite shame u neva came c ya gailxx
ham	ill see but prolly yeah
ham	did u receive my msg
spam	you are awarded a sipix digital camera call from landline delivery within days t cs box mbp yr warranty ppm p p
ham	k can that happen tonight
ham	just buy a pizza meat lovers or supreme u get to pick
spam	free entry in a weekly comp for a chance to win an ipod txt pod to to get entry std txt rate tcs apply for details
ham	im already back home so no probably not
ham	si si i think ill go make those oreo truffles
ham	eat jap done oso aft ur lect wat got lect at rite
ham	dont forget though that i love you and i walk beside you watching over you and keeping your heart warm
ham	im thinking that chennai forgot to come for auction
ham	tomorrow i am not going to theatre so i can come wherever u call me tell me where and when to come tomorrow
ham	same as u dun wan y u dun like me already ah wat u doing now still eating
ham	havent eaten all day im sitting here staring at this juicy pizza and i cant eat it these meds are ruining my life
ham	how long does it take to get it
spam	free message activate your free text messages by replying to this message with the word free for terms conditions visit wwwcom
ham	u attend ur driving lesson how many times a wk n which day
ham	aiyar u so poor thing i give u my support k jia you ill think of u
ham	wot u up thout u were gonna call me txt bak luv k
spam	santa calling would your little ones like a call from santa xmas eve call to book your time
spam	urgent call from landline your complementary tenerife holiday or cash await collection sae tcs po box wa px ppm sender hol offer
ham	hiya comin bristol st week in april les got off rudi on new yrs eve but i was snoringthey were drunk u bak at college yet my work sends ink bath
ham	thanks for ve lovely wisheds you rock
spam	congratulations ur awarded of cd vouchers or gift guaranteed free entry wkly draw txt music to
ham	imagine life without me see how fast u are searching medont worry lm always there to disturb u goodnoon
spam	private your account statement for shows unredeemed sim points call identifier code expires
spam	txt call to no claim your reward of hours talk time to use from your phone now subscribegbpmnth inc hrs stoptxtstop wwwgambtv
spam	got what it takes take part in the wrc rally in oz u can with lucozade energy text rally le to p see packs or lucozadecoukwrc itcould be u
ham	lol enjoy role playing much
ham	ok lor thanx in school
ham	sorry ill call later
ham	im sick im needy i want you pouts stomps feet where are you pouts stomps feet i want my slave i want him now
spam	buy space invaders a chance win orig arcade game console press for games arcade std wap charge see ocoukgames terms settings no purchase
ham	ok omw now you at castor
ham	no its truekdo u knw dis no ltgt
ham	yeah like if it goes like it did with my friends imma flip my shit in like half an hour
ham	ok
spam	free entry into our weekly competition just text the word win to now tc wwwtxttowincouk
ham	any pain on urination any thing else
ham	quite ok but a bit ex u better go eat smth now else ill feel guilty
ham	did u see what i posted on your facebook
ham	k i yan jiu liao sat we can go bugis vill one frm to den hop to parco nb sun can go cine frm to den hop to orc mrt hip hop at
spam	pls stop bootydelious f is inviting you to be her friend reply yes or no see her wwwsmsacubootydelious stop send stop frnd to
ham	yes princess i want to catch you with my big strong hands
spam	freeday sexy st georges day pic of jordantxt pic to dont miss out then every wk a saucy celeb more pics c pocketbabecouk wk
ham	i am seeking a lady in the street and a freak in the sheets is that you
spam	reminder from o to get pounds free call credit and details of great offers pls reply this text with your valid name house no and postcode
ham	okok okthenwhats ur todays plan
ham	i wonder if your phone battery went dead i had to tell you i love you babe
ham	hey cutie how goes it here in wales its kinda ok there is like hills and shit but i still avent killed myself
ham	received understood n acted upon
ham	lol well dont do it without me we could have a big sale together
spam	orange brings you ringtones from all time chart heroes with a free hit each week go to ringtones pics on wap to stop receiving these tips reply stop
ham	is xy going e lunch
ham	no home work to do meh
ham	okie
ham	dear sirsalam alaikkumpride and pleasure meeting you today at the tea shopwe are pleased to send you our contact number at qatarrakhesh an indianpls save our numberrespectful regards
ham	we have all rounderso not required
ham	my darling sister how are you doing whens school resuming is there a minimum wait period before you reapply do take care
ham	hope you are having a great day
spam	you wont believe it but its true its incredible txts reply g now to learn truly amazing things that will blow your mind from ofwd only ptxt
ham	i havent add yet right
ham	maybe i could get book out tomo then return it immediately or something
ham	yes i trust u to buy new stuff asap so i can try it out
ham	smile in pleasure smile in pain smile when trouble pours like rain smile when sum hurts u smile becoz someone still loves to see u smiling
ham	it is a good thing im now getting the connection to bw
ham	is there coming friday is leave for pongaldo you get any news from your work place
ham	yar i wanted scold u yest but late already i where got zhong se qing you if u ask me b he ask me then ill go out w u all lor n u still can act so real
ham	im in inside officestill filling formsdon know when they leave me
ham	cheers u tex mecause u werebored yeah okden hunny r uin wk satsounds likeyour havin grfun j keep updat countinlots of loveme xxxxx
ham	sounds better than my evening im just doing my costume im not sure what time i finish tomorrow but i will txt you at the end
ham	ugh gotta drive back to sd from la my butt is sore
spam	you ve won your costa del sol holiday or await collection call now toclaim sae tc s pobox stockport skxh costpm maxmins
ham	oops i thk i dun haf enuff i go check then tell
ham	since when which side any fever any vomitin
ham	call me da i am waiting for your call
ham	c movie is juz last minute decision mah juz watch lar but i tot not interested
ham	can a not
ham	yeah thats what i was thinking
ham	come back to tampa ffffuuuuuuu
spam	you can stop further club tones by replying stop mix see mytonecomenjoy html for terms club tones cost gbpweek mfl po box mk wt
spam	you have won a guaranteed award or even cashto claim ur award call free on stop getstop on php
ham	change again its e one next to escalator
ham	not tonight mate catching up on some sleep this is my new number by the way
ham	got ur mail dileepthank you so muchand look forward to lots of supportvery less contacts hereremember one venugopal you mentionedtomorrow if not latei shall try to come up till theregoodnight dear
ham	ey calm downon theacusations itxt u cos iwana know wotu r doin at thewend haventcn u in agesring me if ur up nething satlove j xxx
ham	oh ho is this the first time u use these type of words
ham	i want to tel u one thing u should not mistake me k this is the message that you sent
ham	when you came to hostel
ham	there is a first time for everything
ham	and smile for me right now as you go and the world will wonder what you are smiling about and think your crazy and keep away from you grins
ham	yes im small kid and boost is the secret of my energy
ham	yes baby i need to stretch open your pussy
ham	thursday night yeah sure thing well work it out then
ham	how much for an eighth
ham	wat u doing there
ham	oh is it which brand
ham	thank you for callingforgot to say happy onam to you sirjii am fine here and remembered you when i met an insurance personmeet you in qatar insha allahrakhesh ex tata aig who joined tisscotayseer
ham	nt only for driving even for many reasons she is called bbdthts it chikku then hw abt dvg coldheard tht vinobanagar violence hw is the conditionand hw ru any problem
ham	fun fact although you would think armand would eventually build up a tolerance or some shit considering how much he smokes he gets fucked up in like hits
ham	its sunny in california the weathers just cool
ham	convey my regards to him
ham	pick ur fone up now u dumb
ham	honeybee said im d sweetest in d world god laughed amp said waitu havnt met d person reading this msg moral even god can crack jokes gmgngegn
ham	what todaysundaysunday is holidayso no work
ham	call me when youcarlos isare here my phones vibrate is acting up and i might not hear texts
ham	i am in officewhats the mattermsg me nowi will call you at break
spam	want get laid tonight want real dogging locations sent direct ur mob join the uks largest dogging network bt txting gravel to nt eca pmsgp
ham	ok i found dis pierre cardin one which looks normal costs its on sale
ham	good afternoon babe how goes that day any job prospects yet i miss you my love sighs
ham	love you aathilove u lot
spam	got what it takes take part in the wrc rally in oz u can with lucozade energy text rally le to p see packs or lucozadecoukwrc itcould be u
ham	ill be at yours in about mins but look out for me
ham	you do got a shitload of diamonds though
ham	what hello wats talks email address
ham	hi dis is yijue i would be happy to work wif all for gek
ham	indians r poor but india is not a poor country says one of the swiss bank directors he says that ltgt lac crore of indian money is deposited in swiss banks which can be used for taxless budget for ltgt yrs can give ltgt crore jobs to all indians from any village to delhi lane roads forever free power suply to more than ltgt social projects every citizen can get monthly ltgt for ltgt yrs no need of world bank amp imf loan think how our money is blocked by rich politicians we have full rights against corrupt politicians itna forward karo ki pura india padhegm
ham	you said to me before i went back to bed that you cant sleep for anything
ham	hi this is roger from cl how are you
ham	hiya probably coming home weekend after next
ham	theyre doing it to lots of places only hospitals and medical places are safe
ham	if e timing can then i go w u lor
ham	yetunde im in class can you not run water on it to make it ok pls now
ham	you are everywhere dirt on the floor the windows even on my shirt and sometimes when i open my mouth you are all that comes flowing out i dream of my world without you then half my chores are out too a time of joy for me lots of tv shows ill see but i guess like all things you just must exist like rain hail and mist and when my time here is done you and i become one
ham	jus came back fr lunch wif my sis only u leh
ham	u still painting ur wall
spam	ur cashbalance is currently pounds to maximize ur cashin now send go to only pmeg cc hgsuitelands rowwjhl
ham	send me yettys number pls
ham	are you there in room
ham	how r going to send it to me
ham	ill post her out lr in class
ham	never y lei i v lazy got wat dat day send me da url cant work one
ham	i wait inside da car park
ham	awesome be there in a minute
ham	dude whats up how teresa hope you have been okay when i didnt hear from these people i called them and they had received the package since dec ltgt just thot yould like to know do have a fantastic year and all the best with your reading plus if you can really really bam first aid for usmle then your work is done
ham	hi missed your call and my mumhas beendropping red wine all over theplace what is your adress
ham	great so should i send you my account number
ham	under the sea there lays a rock in the rock there is an envelope in the envelope there is a paper on the paper there are words
ham	hi hun im not comin nitetell every im sorry me hope u ava goodtimeoli rang melnite ifink it mite b sortedbut il explain everythin on monlrsx
spam	mths half price orange line rental latest camera phones free had your phone mths call mobilesdirect free on to update now orstoptxt
ham	i just made some payments so dont have that much sorry would you want it fedex or the other way
ham	oh kay on sat right
ham	hey i will be really pretty late you want to go for the lesson first i will join you im only reaching tp mrt
ham	okay but i thought you were the expert
spam	you are being contacted by our dating service by someone you know to find out who it is call from your mobile or landline poboxldns
spam	new textbuddy chat horny guys in ur area just p free receive search postcode or at gaytextbuddycom txt one name to
ham	i am waiting machan call me once you free
ham	yup its at paragon i havent decided whether cut yet hee
ham	get ready for ltgt inches of pleasure
ham	jay is snickering and tells me that x is totally fucking up the chords as we speak
ham	i told that am coming on wednesday
ham	thanx a lot
ham	i cant right this second gotta hit people up first
ham	when people see my msgs they think iam addicted to msging they are wrong bcoz they dont know that iam addicted to my sweet friends bslvyl
ham	goodmorning today i am late for hrs because of back pain
ham	lol where do u come up with these ideas
ham	yup wun believe wat u really neva c e msg i sent shuhui
spam	check out choose your babe videos smsshsexnetun fgkslpopw fgkslpo
spam	our mobile number has won to claim calls us back or ring the claims hot line on
ham	becoz its ltgt jan whn al the post ofice is in holiday so she cn go fr the post oficegot it duffer
ham	that means you got an a in epi shes fine shes here now
ham	nice waitshould you be texting right now im not gonna pay your ticket ya know
ham	thats cool i want to please you
ham	ive been searching for the right words to thank you for this breather i promise i wont take your help for granted and will fulfil my promise you have been wonderful and a blessing at all times
ham	yeah we wouldnt leave for an hour at least hows sound
ham	wen ur lovable bcums angry wid u dnt take it seriously coz being angry is d most childish n true way of showing deep affection care n luv kettoda manda have nice day da
ham	boo hows things im back at home and a little bored already
ham	ill hand her my phone to chat wit u
spam	our dating service has been asked contact u by someone shy call now all will be revealed pobox m uz p
ham	what u talking bout early morning its almost noon where your at
ham	ok c ya
ham	yun buying but school got offer plus only
ham	ok i go change also
ham	yeah probably here for a while
ham	god asked what is forgiveness a little child gave lovely reply it is d wonderful fruit that a tree gives when it is being hurt by a stone good night
ham	ok im waliking ard now do u wan me buy anything go ur house
ham	ok lor sony ericsson salesman i ask shuhui then she say quite gd use so i considering
spam	thanks for your ringtone order reference number x your mobile will be charged should your tone not arrive please call customer services
ham	i love your ass do you enjoy doggy style
ham	and also ive sorta blown him off a couple times recently so id rather not text him out of the blue looking for weed
ham	no screaming means shouting
ham	u repeat e instructions again wats e road name of ur house
spam	ree entry in a weekly comp for a chance to win an ipod txt pod to to get entry std txt rate tcs apply for details
ham	night has ended for another day morning has come in a special way may you smile like the sunny rays and leaves your worries at the blue blue bay gud mrng
ham	sir good morning hope you had a good weekend i called to let you know that i was able to raise ltgt from my dad he however said he would make the rest available by mid feb this amount is still quite short and i was hoping you would help do have a good day abiola
ham	ambrithmaduraimet u in arun dha marrgeremembr
ham	its fine imma get a drink or somethin want me to come find you
ham	hmm thinking lor
ham	nope meanwhile she talk say make i greet you
spam	someone u know has asked our dating service contact you cant guess who call now all will be revealed pobox sxy p
ham	does cinema plus drink appeal tomo is a fr thriller by director i like on at mac at
ham	hmm ill have to think about it ok youre forgiven d
ham	ranjith cal drpd deeraj and deepak min hold
ham	early bird any purchases yet
ham	i got a call from a landline number i am asked to come to anna nagar i will go in the afternoon
ham	ummmmmaah many many happy returns of d day my dear sweet heart happy birthday dear
ham	when i have stuff to sell ill tell you
ham	great comedycant stop laughing da
ham	i wud never mind if u dont miss me or if u dont need me but u wil really hurt me wen u need me amp u dont tell me take care
ham	nowadays people are notixiquating the laxinorficated opportunity for bambling of entropication have you ever oblisingately opted ur books for the masteriastering amplikater of fidalfication it is very champlaxigating i think it is atrocious wotz ur opinion junna
ham	hellohow u doingwhat u been up when will u b moving out of the flat cos i will need to arrange to pick up the lamp etc take care hello caroline
ham	my slave i want you to take or pictures of yourself today in bright light on your cell phone bright light
ham	hey do you want anything to buy
ham	cps is causing the outages to conserve energy
ham	doing my masters when will you buy a bb cos i have for sale and hows bf
ham	omw back to tampa from west palm you hear what happened
ham	sorry completely forgot will pop em round this week if your still here
ham	ki deleted my contact that why
ham	u will switch your fone on dammit
ham	congrats treat pendingi am not on mail for dayswill mail once thrurespect mother at homecheck mails
ham	yes i come to nyc for audiitions and am trying to relocate
spam	you have won cash or a prize to claim call tc rstm sw ss ppm
ham	oh all have to come ah
ham	alright i have a new goal now
spam	great new offer double mins double txt on best orange tariffs and get latest camera phones free call mobileupd free on now or stoptxt tcs
ham	lets pool our money together and buy a bunch of lotto tickets if we win i get ltgt u get ltgt deal
ham	all was well until slightly disastrous class this pm with my fav darlings hope day off ok coffee wld be good as cant stay late tomorrow same time place as always
ham	can i get your opinion on something first
ham	anything lor is she coming
spam	splashmobile choose from s of gr tones each wk this is a subscrition service with weekly tones costing p u have one credit kick back and enjoy
ham	and i dont plan on staying the night but i prolly wont be back til late
ham	glad to see your reply
ham	rightio it is then well arent we all up bright and early this morning
ham	yo call me when you get the chance a friend of mine wanted me to ask you about a big order
spam	free st week entry textpod a chance win gb ipod or cash every wk txt vpod to tscs wwwtextpodnet custcare
ham	i dont have i shall buy one dear
ham	babe im answering you cant you see me maybe youd better reboot ym i got the photo its great
ham	what todaysundaysunday is holidayso no work
ham	when login dat time dad fetching home now
ham	its not that time of the month nor mid of the time
ham	ive reached already
spam	your chance to be on a reality fantasy show call now just p per min ntt ltd po box croydon cr wb is a national rate call
ham	no got new job at bar in airport on satsgettin per hour but means no lie in keep in touch
spam	buy space invaders a chance win orig arcade game console press for games arcade std wap charge see ocoukgames terms settings no purchase
ham	every day i use to sleep after ltgt so only
ham	lemme know when i can swing by and pick up im free basically any time after all this semester
spam	ur balance is now next question complete the landmark big a bob b barry or c ben text a b or c to good luck
ham	sorry ill call later
ham	well that must be a pain to catch
ham	awesome question with a cute answer someone asked a boy how is ur life he smiled amp answered she is fine gudnite
spam	auction round the highest bid is now next maximum bid is to bid send bids e g to bid to good luck
spam	we know someone who you know that fancies you call to find out who pobox lshb p
ham	ok take ur time n enjoy ur dinner
ham	ok u enjoy ur shows
ham	also remember to get dobbys bowl from your car
ham	or remind me in a few hrs
spam	urgent ur guaranteed award is still unclaimed call now closingdate claimcode mm pmmorefrommobilebremovedmobypoboxlsyf
ham	hi hope ur day good back from walk table booked for half eight let me know when ur coming over
ham	ok ur typical reply
ham	you will go to walmart ill stay
ham	will b going to esplanade fr home
ham	k did you call me just now ah
ham	how i noe shes in da car now later then c lar im wearing shorts
ham	then what about further plan
ham	in fact when do you leave i think addie goes back to school tues or wed
ham	for me the love should start with attractioni should feel that i need her every time around meshe should be the first thing which comes in my thoughtsi would start the day and end it with hershe should be there every time i dreamlove will be then when my every breath has her namemy life should happen around hermy life will be named to heri would cry for herwill give all my happiness and take all her sorrowsi will be ready to fight with anyone for heri will be in love when i will be doing the craziest things for herlove will be when i dont have to proove anyone that my girl is the most beautiful lady on the whole planeti will always be singing praises for herlove will be when i start up making chicken curry and end up makiing sambarlife will be the most beautiful thenwill get every morning and thank god for the day because she is with mei would like to say a lotwill tell later
ham	will do have a good day
ham	oh just getting even with u u
ham	carlos is taking his sweet time as usual so let me know when you and patty are donewant to smoke and ill tell him to haul ass
ham	u r too much close to my heart if u go away i will be shattered plz stay with me
ham	you are always putting your business out there you put pictures of your ass on facebook you are one of the most open people ive ever met why would i think a picture of your room would hurt you make you feel violated
ham	now am free call me pa
ham	hostbased idps for linux systems
spam	welcome to select an o service with added benefits you can now call our specially trained advisors free from your mobile by dialling
ham	hey mr and i are going to the sea view and having a couple of gays i mean games give me a bell when ya finish
spam	not heard from u a while call rude chat private line to cum wan c pics of me gettin shagged then text pix to end send stop sam xxx
