label	message
ham	watching cartoon listening music amp at eve had to go temple amp church what about u
ham	yup im free
ham	company is very goodenvironment is terrific and food is really nice
ham	never blame a day in ur life good days give u happiness bad days give u experience both are essential in life all are gods blessings good morning
ham	i wnt to buy a bmw car urgentlyits vry urgentbut hv a shortage of ltgt lacsthere is no source to arng dis amt ltgt lacsthats my prob
ham	ah you see you have to be in the lingo i will let you know wot on earth it is when has finished making it
ham	oh oh den muz change plan liao go back have to yan jiu again
ham	draw vai dont think so
ham	you know there is i shall speak to you in ltgt minutes then
ham	poyyarikaturkolathupalayamunjalur posterode dis ltgt
ham	ok sweet dreams
ham	am i the only one who doesnt stalk profiles
ham	wonders in my world th you th ur style th ur smile th ur personality rd ur nature nd ur sms and st ur lovely friendship good morning dear
ham	it could work well reach a consensus at the next meeting
ham	as in missionary hook up doggy hook up standing
ham	just taste fish curry p
ham	did you show him and wot did he say or could u not c him dust
ham	ill pick you up at about pm to go to taunton if you still want to come
ham	babes i think i got ur brolly i left it in english wil bring it in mrw u luv franxx
ham	gudnitetcpractice going on
ham	an amazing quote sometimes in life its difficult to decide whats wrong a lie that brings a smile or the truth that brings a tear
ham	then you are eldest know
ham	yeah but which is worse for i
ham	be sure to check your yahoo email we sent photos yesterday
ham	oh unintentionally not bad timing great fingers the trains play along will give fifteen min warning
ham	cool ill text you in a few
ham	sindu got job in birla soft
ham	you give us back my id proof and ltgt rs we wont allow you to work we will come to your home within days
ham	what year and how many miles
ham	i though we shd go out n have some fun so bar in town or something sound ok
ham	i am on the way to ur home
ham	ok pa nothing problem
spam	hi ya babe x u goten bout me scammers getting smartthough this is a regular vodafone no if you respond you get further prem rate msgsubscription other nos used also beware
ham	wishing you a wonderful week
ham	what time im out until prob or so
ham	whore you are unbelievable
spam	wamma get laidwant real doggin locations sent direct to your mobile join the uks largest dogging network txt dogs to nownyt eca lp msg
spam	congratulations ur awarded of cd vouchers or gift guaranteed free entry wkly draw txt music to tncs wwwldewcomwinppmxage
ham	whatsup there dont u want to sleep
ham	his bday real is in april
ham	yes now only saw your message
ham	i know you are can you pls open the back
ham	by monday next week give me the full gist
ham	what i told before i tell stupid hear after i wont tell anything to you you dad called to my brother and spoken not with me
ham	sorry no have got few things to do may be in pub later
ham	wait do you know if wesleys in town i bet she does hella drugs
ham	thank you baby i cant wait to taste the real thing
ham	nojst change tat only
ham	ho ho big belly laugh see ya tomo
ham	okie
ham	am on a train back from northampton so im afraid not im staying skyving off today ho ho will be around wednesday though do you fancy the comedy club this week by the way
ham	yes but i dont care i need you bad princess
ham	k dahow many page you want
ham	im at home please call
ham	que pases un buen tiempo or something like that
ham	hey i almost forgot happy bday babe i love ya
spam	as one of our registered subscribers u can enter the draw a gb gift voucher by replying with enter to unsubscribe text stop
ham	god blessget good sleep my deari will pray
spam	thanks for your subscription to ringtone uk your mobile will be charged month please confirm by replying yes or no if you reply no you will not be charged
ham	what are you doing in langport sorry but ill probably be in bed by pm it sucks being ill at xmas when do you and gosri lanka
ham	i promise to take good care of you princess i have to run now please send pics when you get a chance ttyl
ham	greetings me consider yourself excused
spam	reply with your name and address and you will receive by post a weeks completely free accommodation at various global locations wwwphbcom php
ham	huh but i got lesson at lei n i was thinkin of going to sch earlier n i tot of parkin at kent vale
ham	well you know what i mean texting
ham	its worse if if uses half way then stops its better for him to complete it
ham	im done c there
ham	alrite sam its nic just checkin that this is ur numberso is ittb
ham	perhaps is much easy give your account identification so i will tomorrow at uni
ham	came to look at the flat seems ok in his s is away alot wiv work got woman coming at too
ham	great never been better each day gives even more reasons to thank god
ham	purity of friendship between two is not about smiling after reading the forwarded messageits about smiling just by seeing the name gud evng musthu
ham	i wonder how you got online my love had you gone to the net cafe did you get your phone recharged were you on a friends net i think of you boytoy
ham	ill see if i can swing by in a bit got some things to take care of here firsg
ham	do thing change that sentence into because i want concentrate in my educational career im leaving here
ham	i probably wont eat at all today i think im gonna pop how was your weekend did u miss me
ham	solve d case a man was found murdered on ltdecimalgt ltgt afternoon his wife called police police questioned everyone wife siri was sleeping when the murder took place cook i was cooking gardener i was picking vegetables housemaid i went d post office children we went play neighbour we went a marriage police arrested d murderer immediately whos it reply with reason if u r brilliant
ham	hey you got any mail
ham	please charge my mobile when you get up in morning
ham	havent seen my facebook huh lol
ham	jason says its cool if we pick some up from his place in like an hour
ham	do you think i can move ltgt in a week
ham	k k then watch some films
ham	i wonder if youll get this text
ham	whats the staff name who is taking class for us
ham	yup but its not giving me problems now so mayb ill jus leave it
ham	its on in engalnd but telly has decided it wont let me watch it and mia and elliot were kissing damn it
ham	hi jon pete here ive bin spain recently hav sum dinero left bill said u or ur rents mayb interested in it i hav pes so around tb james
ham	i dont have anybodys number i still havent thought up a tactful way to ask alex
ham	im fine hope you are also
ham	hi peteynoim ok just wanted chat coz avent spoken u a long timehope ur doin alritehave good nit at js love ya amx
spam	free entry to the grprizes wkly comp a chance to win the latest nokia psp or cash every wktxt great to httpwwwgrprizescom
ham	jus telling u dat ill b leaving shanghai on st instead so well haf more time meet up cya
spam	get your garden ready for summer with a free selection of summer bulbs and seeds worth only with the scotsman this saturday to stop go notxtcouk
ham	pandy joined w technologies todayhe got job
ham	the guy kadeem hasnt been selling since the break i know one other guy but hes paranoid as fuck and doesnt like selling without me there and i cant be up there til late tonight
ham	nope juz off from work
ham	thats a shame maybe cld meet for few hrs tomo
ham	just curious because my cuz asked what i was up to
ham	you were supposed to wake me up gt
ham	fuck babe i miss you already you know cant you let me send you some money towards your net i need you i want you i crave you
ham	pls i wont belive godnot only jesus
ham	ok lor or u wan me go look u
ham	thanks fills me with complete calm and reassurance
ham	good afternoon my love how goes your day what are you up to i woke early and am online waiting for you hmmm italian boy is online i see grins
spam	urgent your mobile no was awarded a bonus caller prize on this is our nd attempt to contact you call boxqu
ham	hi you just spoke to maneesha v wed like to know if you were satisfied with the experience reply toll free with yes or no
ham	arun can u transfr me d amt
ham	you have come into my life and brought the sun shiny down on me warming my heart putting a constant smile on my face making me feel loved and cared for
spam	do you want a new video phone anytime any network mins inclusive video calls and downloads per week free deltomorrow call or reply now
ham	what u mean u almost done done wif sleeping but i tot u going to take a nap yup i send her liao so im picking her up at ard smth lor
spam	freemsg hi baby wow just got a new cam moby wanna c a hot pic or fancy a chatim win utxt rply chat to hlp msgp rcv
spam	this is the nd time we have tried contact u u have won the pound prize claim is easy call now only p per minute btnationalrate
ham	good afternoon sunshine how dawns that day are we refreshed and happy to be alive do we breathe in the air and smile i think of you my love as always
ham	there the size of elephant tablets u shove um up ur ass
ham	its ok called mom instead have fun
spam	for taking part in our mobile survey yesterday you can now have texts use however you wish get txts just send txt to tc wwwtxtcom p
ham	its too latebut its kwish you the same
ham	thought praps you meant another one goodo ill look tomorrow
ham	aight should i just plan to come up later tonight
ham	i have gone into get info bt dont know what to do
ham	no da if you run that it activate the full version da
ham	he dint tell anything he is angry on me that why you told to abi
ham	the monthly amount is not that terrible and you will not pay anything till months after finishing school
ham	ceri u rebel sweet dreamz me little buddy c ya moro who needs blokes
ham	sorry chikku my cell got some problem thts y i was nt able to reply u or msg u
ham	did u got that persons story
ham	i love ya too but try and budget your money better babe gary would freak on me if he knew
ham	i dunno lei like dun haf
ham	r u here yet im wearing blue shirt n black pants
ham	my sister in law hope you are having a great month just saying hey abiola
ham	its really getting me down just hanging around
ham	i dont think so you dont need to be going out that late on a school night especially when the one class you have is the one you missed last wednesday and probably failed a test in on friday
ham	i sent you the prices and do you mean the ltgt g
ham	howz that persons story
ham	probably a couple hours tops
ham	friendship poem dear o dear u r not near but i can hear dont get fear live with cheer no more tear u r always my dear gud ni
ham	no im in the same boat still here at my moms check me out on yo im half naked
ham	just hopeing that wasnt too pissed up to remember and has gone off to his sisters or something
spam	i dont know u and u dont know me send chat to now and lets find each other only pmsg rcvd hgsuitelandsrowwjhl ldn years or over
ham	pls ask macho how much is budget for bb bold is cos i saw a new one for ltgt dollars
ham	good sleep is about rhythm the person has to establish a rhythm that the body will learn and use if you want to know more
ham	dont worry though i understand how important it is that i be put in my place with a poorly thought out punishment in the face of the worst thing that has ever happened to me brb gonna go kill myself
spam	thanks for your ringtone order reference number xyour mobile will be charged should your tone not arrive please call customer services
spam	congrats year special cinema pass for is yours call now c suprman v matrix starwars etc all free bxipwe pm dont miss out
ham	k sure am in my relatives home sms me de pls
ham	tell them u have a headache and just want to use hour of sick time
ham	your board is working fine the issue of overheating is also reslove but still software inst is pending i will come around o clock
spam	please call our customer service representative on freephone between ampm as you have won a guaranteed cash or prize
ham	i went to project centre
ham	ugh fuck it im resubbing to eve
ham	how are you enjoying this semester take care brother
ham	nohe joined today itself
ham	just getting back home
ham	do u ever get a song stuck in your head for no reason and it wont go away til u listen to it like times
ham	thats cool i am a gentleman and will treat you with dignity and respect
ham	lara said she can loan me ltgt
ham	for real tho this sucks i cant even cook my whole electricity is out and im hungry
ham	haha where got so fast lose weight thk muz go a month den got effect geelater we go aust put bk e weight
ham	okie
ham	argh why the fuck is nobody in town
ham	wiskey brandy rum gin beer vodka scotch shampain wine kudiyarasu dhina vaazhthukkal
ham	ok no prob
ham	why are u up so early
ham	what you did in leave
ham	i am taking you for italian food how about a pretty dress with no panties
ham	i meant middle left or right
ham	are you wet right now
ham	no dear i do have free messages without any recharge hi hi hi
ham	lol ok your forgiven
ham	oh for fucks sake shes in like tallahassee
ham	why didnt u call on your lunch
ham	i dont can you send it to me plus hows mode
spam	well done england get the official poly ringtone or colour flag on yer mobile text tone or flag to now optout txt eng stop box wwx
ham	well then you have a great weekend
ham	ok i will tell her to stay out yeah its been tough but we are optimistic things will improve this month
ham	oh ok i didnt know what you meant yep i am baby jontin
ham	just looked it up and addie goes back monday sucks to be her
ham	just wait till end of march when el nino gets himself oh
ham	company is very goodenvironment is terrific and food is really nice
ham	i dont run away frm u i walk slowly amp it kills me that u dont care enough to stop me
ham	friendship poem dear o dear u r not near but i can hear dont get fear live with cheer no more tear u r always my dear gud ni
ham	would really appreciate if you call me just need someone to talk to
ham	are you happy baby are you alright did you take that job i hope your fine i send you a kiss to make you smile from across the sea kiss kiss
spam	sppok up ur mob with a halloween collection of nokia logopic message plus a free eerie tone txt card spook to
ham	my drive can only be read i need to write
ham	so u gonna get deus ex
ham	not to worry im sure youll get it
ham	yeah its jus rite
ham	nah im goin the wrks with j wot bout u
spam	you have won cash or a prize to claim call
ham	i not at home now lei
ham	hope you are having a great day
ham	oic then better quickly go bathe n settle down
ham	there is os called ubandu which will run without installing in hard diskyou can use that os to copy the important files in system and give it to repair shop
ham	kkapo kgood movie
ham	u sure u cant take any sick time
ham	what was she looking for
spam	bloomberg message center why wait apply for your future httpcareers bloombergcom
ham	k do i need a login or anything
ham	kgive back my thanks
ham	alrite jod hows the revision goin keris bin doin a smidgin n e way u wanna cum over after collegexx
ham	hi i wont b ard christmas but do enjoy n merry xmas
ham	i thought slide is enough
ham	ok c then
ham	what i mean was i left too early to check cos im working a
ham	im ok will do my part tomorrow
ham	i did one slice and one breadstick lol
ham	to the wonderful okors have a great month we cherish you guys and wish you well each day mojibiola
ham	have you started in skye
ham	hey doc pls i want to get nice t shirt for my hubby nice fiting ones my budget is ltgt k help pls i will load d card abi hwkeep me posted luv mj
ham	those ducking chinchillas
ham	i want snow its just freezing and windy
ham	i will vote for wherever my heart guides me
spam	had your mobile mths update for free to oranges latest colour camera mobiles unlimited weekend calls call mobile upd on freefone or stoptxt
ham	wow didnt think it was that common i take it all back ur not a freak unless u chop it off
ham	tap spile at seven is that pub on gas st off broad st by canal ok
ham	i told your number to gautham
ham	aiyah e rain like quite big leh if drizzling i can at least run home
ham	k and youre sure i dont have to have consent forms to do it v
ham	yeah i think my usual guys still passed out from last night if you get ahold of anybody let me know and ill throw down
ham	the sign of maturity is not when we start saying big things but actually it is when we start understanding small things have a nice evening bslvyl
ham	what is this hex place you talk of explain
ham	compliments to you was away from the system how your side
ham	hi the way i was with u day is the normal waythis is the real me ur uniquei hope i know u the rest of mylife hope u find wot was lost
ham	water logging in desert geoenvironmental implications
ham	im in inperialmusic listeningthe weirdest track ever byleafcutter johnsounds like insects being molestedsomeone plumbingremixed by evil men on acid
ham	every mondaynxt week vl be completing
ham	my planning usually stops at find hella weed smoke hella weed
ham	now thats going to ruin your thesis
ham	so now my dad is gonna call after he gets out of work and ask all these crazy questions
ham	aight can you text me the address
ham	then why you came to hostel
ham	good morning plz call me sir
ham	im going for bath will msg you next ltgt min
ham	my uncles in atlanta wish you guys a great semester
ham	senthil group company apnt pm
ham	haha mayb ure rite u know me well da feeling of being liked by someone is gd lor u faster go find one then all gals in our group attached liao
ham	once a fishrman woke early in d mrng it was very dark he waited a while amp found a sack ful of stones he strtd throwin thm in d sea pass time atlast he had jus stone sun rose up amp he found out tht those r nt stones those were diamonds moraldont wake up early in d mrng good night
ham	yes i posted a couple of pics on fb theres still snow outside too im just waking up
ham	what happened in interview
ham	goodmorning today i am late for ltdecimalgt min
spam	i dont know u and u dont know me send chat to now and lets find each other only pmsg rcvd hgsuitelandsrowwjhl ldn years or over
ham	no pic please resend
ham	yep by the pretty sculpture
ham	wish u many many returns of the day happy birthday vikky
ham	arms fine hows cardiff and uni
ham	you know wot people wear t shirts jumpers hat belt is all we know we r at cribbs
ham	lol please do actually send a pic of yourself right now i wanna see pose with a comb and hair dryer or something
ham	po de no need job aha
ham	tick tick tick where are you i could die of loneliness you know pouts stomps feet i need you
ham	great have a safe trip dont panic surrender all
ham	as i entered my cabin my pa said happy bday boss i felt special she askd me lunch after lunch she invited me to her apartment we went there
spam	congrats mobile g videophones r yours call now videochat wid your mates play java games dload polyph music noline rentl
ham	just checking in on you really do miss seeing jeremiah do have a great month
ham	edison has rightly said a fool can ask more questions than a wise man can answer now you know why all of us are speechless during viva gmgngegnt
ham	a boy loved a gal he propsd bt she didnt mind he gv lv lttrs bt her frnds threw thm again d boy decided aproach d gal dt time a truck was speeding towards d gal wn it was about hit d girld boy ran like hell n saved her she asked hw cn u run so fast d boy replied boost is d secret of my energy n instantly d girl shouted our energy n thy lived happily gthr drinking boost evrydy moral of d story i hv free msgsd gud ni
ham	you didnt hear it from me
ham	ya when are taking ure practical lessons i start in june
ham	do you mind if i ask what happened you dont have to say if it is uncomfortable
ham	me babe i feel the same lets just get about itboth try cheer upnot fit soo muchxxlove u locaxx
ham	sorry i will be able to get to you see you in the morning
ham	boo what time u get out u were supposed to take me shopping today
ham	so when do you wanna gym harri
ham	oops got that bit
ham	i think im waiting for the same bus inform me when you get there if you ever get there
ham	alex knows a guy who sells mids but hes down in south tampa and i dont think i could set it up before like
ham	thk some of em find wtc too far weiyi not goin e rest i dunno yet r ur goin dinner den i might b able to join
spam	you have an important customer service announcement call freephone now
ham	where you what happen
ham	ard like dat y
ham	found it enc ltgt where you at
spam	hey boys want hot xxx pics sent direct ur phone txt porn to hrs free and then just p per day to stop text stopbcm sf wcnxx
ham	can i meet at as where depends on where wan in lor
ham	i dont have any of your file in my bagi was in work when you called mei ll tell you if i find anything in my room
ham	let me know when youve got the money so carlos can make the call
ham	captain is in our room
ham	got wat to buy tell us then no need to come in again
ham	dear good morning now only i am up
ham	oh and by the way you do have more food in your fridge want to go out for a meal tonight
ham	beautiful truth against gravity read carefully our heart feels light when someone is in it but it feels very heavy when someone leaves it goodmorning
ham	im just wondering what your doing right now
ham	ltgt of pple marry with their lovers becz they hav gud undrstndng dat avoids problems i sent dis u u wil get gud news on friday by d person you like and tomorrow will be the best day of your life dont break this chain if you break you will suffer send this to ltgt frnds in ltgt mins whn u read
ham	how much is torch in ja
ham	she just broke down a list of reasons why nobodys in town and i cant tell if shes being sarcastic or just faggy
ham	yetunde im sorry but moji and i seem too busy to be able to go shopping can you just please find some other way to get what you wanted us to get please forgive me you can reply free via yahoo messenger
ham	ive not called you in a while this is hoping it was lr malaria and that you know that we miss you guys i miss bani big so pls give her my love especially have a great day
ham	well the weather in calis great but its complexities are great you need a car to move freely its taxes are outrageous but all in all its a great place the sad part is i missing home
ham	sorry ill call later
ham	nothin comes to my mind help me buy hanger lor ur laptop not heavy
ham	much better now thanks lol
ham	yesim in office da
ham	send me your resume
ham	hi elaine is todays meeting confirmed
ham	r u over scratching it
ham	no messages on her phone im holding it now
ham	staffsciencenusedusgphyhcmkteachingpc
ham	how many times i told in the stage all use to laugh you not listen aha
ham	youll never believe this but i have actually got off at taunton wow
ham	watching cartoon listening music amp at eve had to go temple amp church what about u
ham	not a drop in the tank
ham	hey sorry i didntgive ya a a bellearlier hunnyjust been in bedbut mite go thepub ltr if uwana mt uploads a luv jenxxx
spam	free ringtone text first to for a poly or text get to for a true tone help after st free tones are xpw to end txt stop
ham	anytime lor
ham	can you plz tell me the ans bslvyl sent via fullonsmscom
ham	v ma fan
ham	meeting u is my work tel me when shall i do my work tomorrow
ham	good afternoon my love how goes that day i hope maybe you got some leads on a job i think of you boytoy and send you a passionate kiss from across the sea
ham	ya very nice be ready on thursday
ham	hello my love how went your day are you alright i think of you my sweet and send a jolt to your heart to remind you i love you can you hear it i screamed it across the sea for all the world to hear ahmad al hallaq is loved and owned possessive passionate kiss
ham	see i knew giving you a break a few times woul lead to you always wanting to miss curfew i was gonna gibe you til one but a midnight movie is not gonna get out til after you need to come home you need to getsleep and if anything you need to b studdying ear training
ham	yup from what i remb i think should be can book
ham	can all decide faster cos my sis going home liao
ham	jade its paul y didnt u txt me do u remember me from barmed i want talk u txt me
ham	oops i was in the shower when u called hey a parking garage collapsed at university hospital see im not crazy stuff like that does happen
ham	ya ok then had dinner
ham	ok lor
ham	love has one law make happy the person you love in the same way friendship has one law never make ur friend feel alone until you are alive gud night
spam	s of girls many local u who r virgins this r ready fil ur every sexual need can u fil theirs text cute to p m
ham	oh ya ya i remember da
ham	u dont know how stubborn i am i didnt even want to go to the hospital i kept telling mark im not a weak sucker hospitals are for weak suckers
ham	ok ill do you right later
ham	do thing change that sentence into because i want concentrate in my educational career im leaving here
ham	mmmmmmm snuggles into you deep contented sigh whispers i fucking love you so much i can barely stand it
ham	yup no need ill jus wait e rain stop
ham	in work now going have in few min
ham	no it was cancelled yeah baby well that sounds important so i understand my darlin give me a ring later on this fone love kate x
ham	miles and smiles r made frm same letters but do u know d difference smile on ur face keeps me happy even though i am miles away from u keep smiling good nyt
ham	you all ready for big day tomorrow
ham	thats ok i popped in to ask bout something and she said youd been in are you around tonght wen this girl comes
ham	it certainly puts things into perspective when something like this happens
ham	no its waiting in e car dats bored wat cos wait outside got nothing do at home can do my stuff or watch tv wat
