label	message
spam	did you hear about the new divorce barbie it comes with all of kens stuff
ham	stupidits not possible
ham	got it it looks scrumptious daddy wants to eat you all night long
ham	never blame a day in ur life good days give u happiness bad days give u experience both are essential in life all are gods blessings good morning
spam	text get more ringtones logos and games from wwwtxtcom questions infotxtcouk
ham	night has ended for another day morning has come in a special way may you smile like the sunny rays and leaves your worries at the blue blue bay gud mrng
ham	no gifts you trying to get me to throw myself off a cliff or something
ham	ill let you know when it kicks in
ham	sure i am driving but will reach my destination soon
ham	alright were hooked up where you guys at
ham	tell where you reached
spam	private your account statement for shows unredeemed s i m points call identifier code expires
ham	she was supposed to be but couldnt make it shes still in town though
ham	you intrepid duo you have a great time and see you both soon
ham	how is it possible to teach you and where
ham	hahahause your brain dear
spam	you are guaranteed the latest nokia phone a gb ipod mp player or a prize txt word collect to no ibhltd ldnwh pmtmsgrcvd
ham	thinking of u x
ham	here got lots of hair dresser fr china
ham	hi dahow is the todays class
ham	how do you plan to manage that
ham	watching tv lor nice one then i like lor
ham	goodmorning today i am late for ltgt min
ham	i know dat feelin had it with pete wuld get with em nuther place nuther time mayb
ham	watever relation u built up in dis world only thing which remains atlast iz lonlines with lotz n lot memories feeling
spam	congratulations ur awarded either of cd gift vouchers free entry our weekly draw txt music to tncs wwwldewcomwinppmxage
ham	the gas station is like a block away from my house youll drive right by it since armenia ends at swann and you have to take howard
ham	i cant pick the phone right now pls send a message
ham	did either of you have any ideas do you know of anyplaces doing something
ham	no problem with the renewal ill do it right away but i dont know his details
ham	wat uniform in where get
ham	hellodrivbyquit edrunk sorry iff pthis makes no senrddnot no how dancce drum n basqihave fun nhite x ros xxxxxxx
ham	wait ltgt min
spam	thanks your continued support your question this week will enter u in our draw cash name the new us president txt ans to
ham	im home
ham	where is it is there any opening for mca
ham	its a big difference ltgt versus ltgt every ltgt hrs
ham	lol your always so convincing
ham	i doubt you could handle times per night in any case
ham	some of them told accenture is not confirm is it true
ham	hi darlin ive just got back and i had a really nice night and thanks so much for the lift see u tomorrow xxx
ham	gud mrng dear hav a nice day
ham	im not smoking while people use wylie smokes too much to justify ruining my shit
spam	win a shopping spree every week starting now play text store to skilgme tscs winawk age perweeksub
ham	i think u have the wrong number
ham	hi here have birth at on the to at lb oz mother and baby doing brilliantly
spam	congrats nokia video camera phone is your call calls cost ppm ave call mins vary from mobiles close post bcm ldn wcnxx
ham	except theres a chick with huge boobs
spam	please call our customer service representative on between ampm as you have won a guaranteed cash or prize
ham	hi test on ltgt rd
ham	are you free nowcan i call now
ham	hello baby did you get back to your moms are you setting up the computer now filling your belly how goes it loverboy i miss you already sighs
spam	urgent your mobile number has been awarded with a prize guaranteed call from land line claim valid hrs only ppm
spam	sms auction a brand new nokia is up auction today auction is free join take part txt nokia to now hgsuitelands rowwjhl
ham	kkhow is your business now
ham	kkhow much does it cost
ham	haf u eaten wat time u wan me come
ham	mmmmm it was sooooo good to wake to your words this morning my love mmmm fuck i love you too my lion devouring kiss from across the sea
ham	yes i know the cheesy songs from frosty the snowman
ham	is it ok if i stay the night here xavier has a sleeping bag and im getting tired
ham	idk you keep saying that youre not but since he moved we keep butting heads over freedom vs responsibility and im tired i have so much other shit to deal with that im barely keeping myself together once this gets added to it
ham	okies ill go yan jiu too we can skip ard oso go cine den go mrt one blah blah blah
ham	im watching lotr w my sis dis aft so u wan meet me dinner at nite a not
ham	i am in escape theatre now going to watch kavalan in a few minutes
ham	do not b late love mum
spam	for ur chance to win a cash every wk txt action to tscs wwwmovietriviatv custcare xpwk
ham	shall i come to get pickle
ham	i am waiting for your call sir
ham	the baskets gettin full so i might be by tonight
ham	neshanthtel me who r u
ham	well its not like you actually called someone a punto that woulda been worse
ham	is ur changes da report big cos ive already made changes da previous report
ham	st andre virgils cream
spam	had your contract mobile mnths latest motorola nokia etc all free double mins text on orange tariffs text yes for callback no to remove from records
ham	have a good trip watch out for remember when you get back we must decide about easter
ham	pls come quick cant bare this
ham	yessura in sun tvlol
ham	im parked next to a mini when are you coming in today do you think
ham	enjoy the showers of possessiveness poured on u by ur loved ones bcoz in this world of lies it is a golden gift to be loved truly
spam	freemsg month unlimited free calls activate smartcall txt call to no subscriptngbpwk unlimited calls help stoptxt stop landlineonly
ham	that way transport is less problematic than on sat night by the way if u want to ask n to join my bday feel free but need to know definite nos as booking on fri
ham	thankyou so much for the call i appreciate your care
ham	yes rent is very expensive so its the way we save
ham	morning only i can ok
ham	sorry went to bed early nightnight
spam	sms ac blind date u rodds is m from aberdeen united kingdom check him out httpimg sms acwicmbcktzr no blind dates send hide
ham	hi babe its me thanks for coming even though it didnt go that welli just wanted my bed hope to see you soon love and kisses xxx
ham	we left already we at orchard now
ham	hope you are not scared
ham	is it your yahoo boys that bring in the perf or legal
ham	im working technical support voice process
spam	ringtoneking
ham	aight thatll work thanks
ham	aight let me know when youre gonna be around usf
ham	just finished eating got u a plate not leftovers this time
ham	i got like ltgt i can get some more later though get whatever you feel like
ham	then ask dad to pick up lar wan stay until meh
ham	i am in escape theatre now going to watch kavalan in a few minutes
ham	dad went out oredi
ham	he neva grumble but i sad lor hee buy tmr lor aft lunch but we still meetin lunch tmr a not neva hear fr them lei got a lot of work ar
ham	lol ok ill try to send be warned sprint is dead slow youll prolly get it tomorrow
ham	lol grr my mom is taking forever with my prescription pharmacy is like minutes away ugh
ham	same here but i consider walls and bunkers and shit important just because i never play on peaceful but i guess your place is high enough that it dont matter
ham	its okcome to my home it vl nice to meet and v can chat
spam	u can win of music gift vouchers every week starting now txt the word draw to tscs wwwldewcom skillgamewinaweek ageppermesssubscription
ham	ok lor then we go tog lor
ham	so what u doing today
spam	congratulations youve won youre a winner in our august prize draw call now prize code
spam	mobile club choose any of the top quality items for your mobile cfcaa
ham	then any special there
ham	wiskey brandy rum gin beer vodka scotch shampain wine kudiyarasu dhina vaazhthukkal
ham	do u noe wat time e place dat sells d closes
ham	rajipls do me a favour pls convey my birthday wishes to nimya pls today is her birthday
ham	were all getting worried over here derek and taylor have already assumed the worst
ham	where are you what are you doing are yuou working on getting the pc to your moms did you find a spot that it would work i need you
ham	eh ur laptop got no stock lei he say mon muz come again to take a look c got a not
ham	whats a feathery bowa is that something guys have that i dont know about
ham	just sent it so what type of food do you like
ham	i cant talk to you nowi will call when i candont keep calling
ham	aight what time you want me to come up
ham	i think that tantrums finished so yeah ill be by at some point
ham	good do you think you could send me some pix i would love to see your top and bottom
ham	ok lor
ham	why dont you go tell your friend youre not sure you want to live with him because he smokes too much then spend hours begging him to come smoke
ham	ladies first and genus second k
spam	private your account statement for fone no shows unredeemed s i m points call identifier code expires
ham	beautiful tomorrow never comes when it comes its already today in the hunt of beautiful tomorrow dont waste your wonderful today goodmorning
ham	shuhui say change suntec steamboat u noe where where r u now
ham	okie thanx
ham	awesome plan to get here any time after like ltgt ill text you details in a wee bit
ham	whenwhere do i pick you up
ham	dear got train and seat mine lower seat
ham	hm good morning headache anyone
ham	im good have you registered to vote
ham	lol no just trying to make your day a little more interesting
ham	haha hope can hear the receipt sound gd luck
ham	storming msg wen u lift d phne u say hello do u knw wt is d real meaning of hello its d name of a girl yes and u knw who is dat girl margaret hello she is d girlfrnd f grahmbell who invnted telphone moralone can get d name of a person bt not his girlfrnd g o o d n i g h t
ham	lmao but its so fun
ham	tee hee off to lecture cheery bye bye
ham	oops sorry just to check that you dont mind picking me up tomo at half eight from station would that be ok
ham	take something for pain if it moves however to any side in the next hrs see a doctor
ham	ltgt great loxahatchee xmas tree burning update you can totally see stars here
ham	was playng doors game and gt racing on phone lol
spam	you have new message please call
spam	congrats mobile g videophones r yours call now videochat wid ur mates play java games dload polyh music noline rentl bx ip we pm
ham	i keep ten rs in my shelf buy two egg
ham	still i have not checked it da
ham	yes but i dont care cause i know its there
ham	be happy there i will come after noon
ham	under the sea there lays a rock in the rock there is an envelope in the envelope there is a paper on the paper there are words
ham	dunno dats wat he told me ok lor
ham	sorry ill call later
ham	ok lor
ham	hey leave it not a big deal take care
ham	princess is your kitty shaved or natural
ham	arr birthday today i wish him to get more oscar
ham	youre gonna have to be way more specific than that
ham	thanx
ham	its a valentine game send dis msg to all ur friends if answers r d same then someone really loves u ques which colour suits me the best
ham	hui xin is in da lib
ham	you are a very very very very bad girl or lady
spam	had your mobile mths update for free to oranges latest colour camera mobiles unlimited weekend calls call mobile upd on freefone or stoptx
ham	thank you princess you are so sexy
ham	no i am not having not any movies in my laptop
spam	yes the only place in town to meet exciting adult singles is now in the uk txt chat to now pmsg
ham	i sent them do you like
ham	o well uv causes mutations sunscreen is like essential thesedays
ham	its cool let me know before it kicks off around ltgt ill be out and about all day
ham	stupid auto correct on my phone
ham	almost there see u in a sec
ham	ok u can take me shopping when u get paid d
ham	already one guy loving you
ham	i had askd u a question some hours before its answer
ham	i want to lick your pussy now
ham	how dare you change my ring
ham	hey no i ad a crap nite was borin without ya boggy with me u boring biatch thanx but u wait til nxt time il ave ya
ham	sorry da thangamits my mistake
ham	call to the number which is available in appointment and ask to connect the call to waheed fathima
ham	i liked the new mobile
ham	no its not specialisation can work but its slave labor will look for it this month sha cos no shakara beggar
ham	i absolutely love south park i only recently started watching the office
ham	are you willing to go for apps class
ham	quite lor but dun tell him wait he get complacent
ham	fwiw the reason im only around when its time to smoke is that because of gas i can only afford to be around when someone tells me to be and that apparently only happens when somebody wants to light up
spam	urgent please call from your landline your complimentary lux costa del sol holiday or cash await collection ppm sae tcs james ehrr
ham	mm you ask him to come its enough
spam	get ur st ringtone free now reply to this msg with tone gr top tones to your phone every week just per wk opt out send stop
spam	between ampm cost p
ham	am not interested to do like that
ham	aight ill get on fb in a couple minutes
ham	ill call you evening ill some ideas
ham	you could have seen mei didt recognise you face
ham	now got tv watch meh u no work today
spam	you are guaranteed the latests nokia phone a gb ipod mp player or a prize txt wordcollect to no tcllc nyusa pmt msgrcvd
ham	im gonna rip out my uterus
ham	rajipls do me a favour pls convey my birthday wishes to nimya pls today is her birthday
ham	din i tell u jus now
ham	was the farm open
ham	i dont knw pa i just drink milk
ham	fuck cedar key and fuck her come over anyway tho
ham	it so happens that there r waxsto do wat you want she can come and ill get her medical insurance and shell be able to deliver and have basic care im currently shopping for the right medical insurance for her so just give me til friday morning thats when ill see the major person that can guide me to the right insurance
ham	same as kallis dismissial in nd test
ham	can you plz tell me the ans bslvyl sent via fullonsmscom
ham	he is there you call and meet him
ham	ummmmmaah many many happy returns of d day my dear sweet heart happy birthday dear
ham	noi got rumour that you going to buy apartment in chennai
ham	he remains a bro amongst bros
ham	s now only i took tablets reaction morning only
ham	were trying to find a chinese food place around here
ham	hi di is yijue were meeting at pm at esaplanade tonight
ham	ok
ham	hey u still at the gym
ham	nope thats fine i might have a nap tho
ham	sending you greetings of joy and happiness do have a gr evening
ham	depends on individual lor e hair dresser say pretty but my parents say look gong u kaypoh i also dunno wat she collecting
spam	camera you are awarded a sipix digital camera call fromm landline delivery within days
ham	aft i finish my lunch then i go str down lor ard smth lor u finish ur lunch already
spam	freemsg fancy a flirt reply date now join the uks fastest growing mobile dating service msgs rcvd just p to optout txt stop to reply date now
ham	fuck babe what happened to you how come you never came back
ham	purity of friendship between two is not about smiling after reading the forwarded messageits about smiling just by seeing the name gud evng
ham	or maybe my fat fingers just press all these buttons and it doesnt know what to do
ham	thank u
ham	sry dajst nw only i came to home
ham	you got called a tool
ham	great i shoot big loads so get ready
ham	leave it u will always be ignorant
ham	da is good good playerwhy he is unsold
spam	congratulations u can claim vip row a tickets c blu in concert in november or blu gift guaranteed call to claim tscs wwwsmsconet costmax
ham	do you still have the grinder
spam	u have a secret admirer who is looking make contact with ufind out who they rreveal who thinks ur so specialcall on stopsms
spam	youve won tkts to the euro cup final or cash to collect call b pobox ppm
spam	you are a winner u have been specially selected receive cash or a holiday flights inc speak to a live operator claim
ham	just making dinner you
ham	try to do something dear you read something for exams
ham	well thats nice too bad i cant eat it
ham	correct so how was work today
ham	have you emigrated or something ok maybe was a bit hopeful
spam	freeringtonereply real
ham	probably gonna swing by in a wee bit
ham	haha can but im having dinner with my cousin
ham	im in office now i will call you ltgt min
ham	no b thursday
ham	so why didnt you holla
ham	watching tv now i got new job
ham	hmm dunno leh mayb a bag goigng out dat is not too small or jus anything except perfume smth dat i can keep
ham	oh yes ive just been a little under the weather so ive kind of been coccooning at home
ham	thats necessarily respectful
ham	customer place i will call you
ham	you have got tallent but you are wasting
ham	yes i have so thats why u texted pshewmissing you so much
spam	do you want a new nokia i colour phone deliveredtomorrow with free minutes to any mobile free texts free camcorder reply or call
ham	dearme at cherthalain case u r coming cochin pls call bfore u starti shall also reach accordinglyor tell me which day u r comingtmorow i am engaged ans its holiday
spam	important information orange user xxxxxxx today is your lucky dayfind out why log onto httpwwwurawinnercom theres a fantastic surprise awaiting you
ham	good evening sir al salam wahleykkumsharing a happy newsby the grace of god i got an offer from tayseertissco and i joinedhope you are fineinshah allahmeet you sometimerakheshvisitor from india
ham	do noe if ben is going
ham	audrie lousy autocorrect
ham	sir waiting for your mail
ham	call me when ure done
ham	what i meant to say is cant wait to see u again getting bored of this bridgwater banter
ham	en chikku nange bakra msg kalstiyathen had teacoffee
ham	hello my love what are you doing did you get to that interview today are you you happy are you being a good boy do you think of meare you missing me
spam	you are a winner or guaranteed caller prize this is our final attempt to contact you to claim call now ppmpoboxbhambxe
ham	going to take your babe out
ham	dad wanted to talk about the apartment so i got a late start omw now
ham	you flippin your shit yet
ham	well im gonna finish my bath now have a goodfine night
ham	sounds like something that someone testing me would sayy
ham	dearshall mail tonitebusy in the streetshall update you tonitethings are looking okvarunnathu edukkukayee raksha ollubut a good one in real sense
ham	do you know why god created gap between your fingers so that one who is made for you comes amp fills those gaps by holding your hand with love
ham	oh dang i didnt mean o send that to you lol
ham	that said can you text him one more time
ham	k wait chikkuil send aftr ltgt mins
ham	so that takes away some money worries
spam	hmv bonus special pounds of genuine hmv vouchers to be won just answer easy questions play now send hmv to more infowwwpercentrealcom
spam	free top ringtone sub to weekly ringtoneget st week freesend subpoly to per weekstop sms
ham	no management puzzeles
ham	ok no wahala just remember that a friend in need
ham	long after i quit i get on only like minutes a day as it is
ham	what u wearing
ham	oh thats late well have a good night and i will give u a call tomorrow iam now going to go to sleep night night
ham	how long has it been since you screamed princess
ham	remember all those whom i hurt during days of satanic imposter in meneed to pay a priceso be itmay destiny keep me going and as u said pray that i get the mind to get over the same
ham	lul im gettin some juicy gossip at the hospital two nurses are talking about how fat they are gettin and one thinks shes obese oyea
ham	k so am i how much for an th fifty
ham	no i am not having not any movies in my laptop
ham	where are you what do you do how can you stand to be away from me doesnt your heart ache without me dont you wonder of me dont you crave me
ham	actually im waiting for weeks when they start putting ad
ham	yup i shd haf ard pages if i add figures all got how many pages
spam	your account for xxxxxxxxx shows unredeemed points to claim call identifier code xxxxx expires
ham	cool text me when youre parked
ham	me not waking up until in the afternoon sup
ham	neft transaction with reference number ltgt for rs ltdecimalgt has been credited to the beneficiary account on ltgt at lttimegt ltgt
ham	soon you will have the real thing princess do i make you wet
ham	send ur birthdate with month and year i will tel u ur life partners name and the method of calculation reply must
spam	monthly password for wap mobsicom is use your wap phone not pc
ham	god created gap btwn ur fingers so dat sum vry special will fill those gaps by holding ur hands now plz dont ask y he created so much gap between legs
ham	whos this am in class
ham	i dun thk ill quit yet hmmm can go jazz yogasana oso can we can go meet em after our lessons den
ham	exactly anyways how far is jide her to study or just visiting
ham	hey hey werethe monkeespeople say we monkeyaround howdy gorgeous howu doin foundurself a jobyet sausagelove jen xxx
ham	sir i am waiting for your call once free please call me
ham	you do what all you like
ham	wat r u doing now
ham	awww dat is sweet we can think of something to do he he have a nice time tonight ill probably txt u later cos im lonely xxx
ham	yunny im walking in citylink now faster come down me very hungry
ham	yep get with the program youre slacking
ham	ok not much to do here though hm friday cant wait dunno wot the hell im gonna do for another weeks become a slob oh wait already done that
ham	wherres my boytoy
ham	but am going to college pa what to do are else ill come there it self pa
ham	dear take care i am just reaching homelove u a lot
ham	i hav almost reached call i m unable to connect u
spam	guess what somebody you know secretly fancies you wanna find out who it is give us a call on from landline dateboxessexcmxn pmin
ham	i cant pick the phone right now pls send a message
ham	tension face smiling face waste face innocent face terror face cruel face romantic face lovable face decent face ltgt joker face
spam	this is the nd time we have tried contact u u have won the pound prize claim is easy call now only p per min btnationalrate
ham	dunno lei all decide lor how abt leona oops i tot ben is going n i msg him
ham	when you are big god will bring success
ham	gwr
ham	i think chennai well settled
ham	i got another job the one at the hospital doing data analysis or something starts on monday not sure when my thesis will got finished
ham	i think just yourself thanks and see you tomo
spam	last chance claim ur worth of discount vouchers today text shop to now savamob offers mobile t cs savamob pobox muz sub
ham	do you know what mallika sherawat did yesterday find out now lturlgt
ham	right on brah see you later
ham	goodmorning sleeping ga
ham	dont think you need yellow card for uk travel ask someone that has gone before if you do its just ltgt bucks
ham	we are pleased to inform that your application for airtel broadband is processed successfully your installation will happen within days
ham	get ready to moan and scream
ham	ok i feel like john lennon
ham	k fyi im back in my parents place in south tampa so i might need to do the deal somewhere else
spam	tddnewsletteremccouk more games from thedailydraw dear helen dozens of free games with great prizeswith
spam	free for st week no nokia tone ur mobile every week just txt nokia to get txting and tell ur mates wwwgetzedcouk pobox wwq normptone
ham	in e msg jus now u said thanks for gift
ham	ya toldshe was asking wats matter
ham	check wid corect speling ie sarcasm
ham	i know you are serving i mean what are you doing now
ham	dai ltgt naal eruku
ham	short but cute be a good person but dont try to prove gud mrng
ham	wah lucky man then can save money hee
ham	going on nothing greatbye
ham	k ill take care of it
ham	aight im chillin in a friends room so text me when youre on the way
ham	k ill drinkpa then what doing i need srs model pls send it to my mail id pa
ham	take care n get well soon
ham	christmas is an occasion that is celebrated as a reflection of ur values desires affectionsamp traditions have an ideal christmas
ham	howz painhope u r fine
ham	and hows your husband
ham	let me know if you need anything else salad or desert or something how many beers shall i get
ham	unlimited texts limited minutes
ham	omg it could snow here tonite
ham	can you open the door
ham	havent
ham	cool text me when youre ready
ham	have you not finished work yet or something
ham	not sure yet still trying to get a hold of him
ham	what your plan for pongal
ham	was a nice day and impressively i was sensible went home early and now feel fine or am i just boring whens yours i cant remember
spam	customer loyalty offerthe new nokia mobile from only at txtauction txt word start to no get yours now tctxt tc pmtmsg
ham	sorry in meeting ill call you later
ham	dont worry day very big lambu ji vl cometil then enjoy batchlor party
ham	kaiez enjoy ur tuition gee thk e second option sounds beta ill go yan jiu den msg u
spam	get lions england tone reply lionm mono or lionp poly more go wwwringtonescouk the original n best tones gbp network operator rates apply
ham	im really not up to it still tonight babe
ham	you getting back any time soon
ham	sorry that was my uncle ill keep in touch
spam	dear dave this is your final notice to collect your tenerife holiday or cash award call from landline tcs sae box cwwx ppm
ham	a lot of this sickness thing going round take it easy hope u feel better soon lol
ham	depends on quality if you want the type i sent boye faded glory then about if you want ralphs maybe
ham	lol thats different i dont go trying to find every real life photo you ever took
